<?xml version="1.0" encoding="UTF-8"?>
<!--
To change this license header, choose License Headers in Project Properties.
To change this template file, choose Tools | Templates
and open the template in the editor.
-->

<!DOCTYPE order SYSTEM 'bonanza.dtd'>

<order type="takeout">
    <customer>George</customer>
    <burger>
        <patty type="beef" />
        <cheeses top="american" bottom="swiss" />
        <toppings type="shrooms" />
        <sauce type="ketchup"/>
        <sauce type="mayo" />
    </burger>
    <burger>
        <patty type="beef" />
        <cheeses top="gruyerer" />
        <toppings type="shrooms" />
        <sauce type="ketchup"/>
        <sauce type="mayo" />
    </burger>
    <burger>
        <patty type="beef" />
        <cheeses top="gruyerer" />
        <toppings type="shrooms" />
        <sauce type="ketchup"/>
        <sauce type="mayo" />
    </burger>
</order>
